### ISSUE TITLE
Commit 690b3659eda96f9f566355bf5555ed52912a67ac breaks "update"

### ISSUE THREAD

**Issue by mape2k** [mikepultz/netdns2#65]
After upgrading to commit 690b3659eda96f9f566355bf5555ed52912a67ac Net_DNS2_Updater did not work anymore. $u->update() returns true and did not throw an Exception. But the update did not work - see tcpdump log. I'm using TSIG for update.

Before commit:
23:49:36.925824 IP localhost.domain > localhost.60795: 23078*- 1/0/0 AAAA 2a01::1 (72)
23:49:36.928080 IP localhost.50297 > localhost.domain: 23079 update+ [2n] [1au] SOA? dyndns.example.org. (195)
23:49:36.930180 IP localhost.domain > localhost.50297: 23079 update*- 0/0/1 (148)

After commit:
23:49:54.364519 IP localhost.domain > localhost.40795: 27418*- 1/0/0 AAAA 2a01::1 (72)
23:49:54.366737 IP localhost.52397 > localhost.domain: 27419+ [2n] [1au] SOA? dyndns.example.org. (195)

**Comment by mikepultz** [comment]
Thanks @mape2k, I've just pushed a change to trunk that should put things back to normal.

Mike

**Comment by mape2k** [comment]
@mikepultz: Thank you. Trunk now works as expected on DNS updates.
